ID,TH,EN,S_CN,T_CN,JP
001,มิกิตื่นหรือยัง,Is Miki awake yet?,001,001,001
002,ตื่นแล้วเหรอ มิกิ,Are you awake; Miki?,002,002,002
003,มีอะไรเหรอ ทำไมเหงื่อออกเยอะขนาดนี้,What's wrong? Why are you sweating so much?,003,003,003
004,อ้อ! แมวเหรอ มิกิเปิดแระตูไว้นี่นา แมวมันคงเข้ามาทางนั้นแหล่ะ,Oh! A cat? Miki; you left the window open. The cat probably came in that way.,004,004,004
005,ไม่มีอะไรแล้วล่ะ ไปอาบน้ำแล้วลงมากินข้าวเถอะนะ,There's nothing. Go take a shower and then come down to eat.,005,005,005